{
  "$schema": "https://raw.githubusercontent.com/yxxbc/wmlUpdate/main/schema/config.schema.json",
  "schema_version": 1,
  "app_id": "com.example.myapp",
  "channel": "stable",
  "current_version": "1.4.2",
  "source": {
    "type": "static",
    "manifest_url": "https://updates.example.com/myapp/stable/manifest.json",
    "headers": {
      "Authorization": "Bearer ${UPDATE_TOKEN}"
    }
  },
  "asset_rules": [
    {"os": "darwin", "arch": "arm64", "match": "myapp-*-darwin-arm64.zip", "format": "zip"},
    {"os": "windows", "arch": "amd64", "match": "myapp-*-windows-amd64.zip", "format": "zip"},
    {"os": "linux", "arch": "amd64", "match": "myapp-*-linux-amd64.tar.gz", "format": "tar.gz"}
  ],
  "install": {
    "type": "directory",
    "paths": {
      "darwin": "/Applications/MyApp.app",
      "windows": "C:\\Program Files\\MyApp",
      "linux": "/opt/myapp"
    },
    "preserve": ["data/**", "config/**"],
    "keep_backups": 2
  },
  "security": {
    "public_key_file": "keys/signing-key.pub.pem",
    "allowed_hosts": ["updates.example.com"]
  }
}
